{
  "$schema": "https://anthropic.com/claude-code/marketplace.schema.json",
  "name": "lklimek",
  "owner": {
    "name": "lklimek",
    "url": "https://github.com/lklimek"
  },
  "metadata": {
    "description": "AI agent plugins for blockchain developers. Skills, agents, and tools for the Dash Platform ecosystem and beyond.",
    "version": "1.0.178"
  },
  "plugins": [
    {
      "name": "claudash",
      "source": {
        "source": "github",
        "repo": "lklimek/claudash"
      },
      "version": "0.5.0",
      "description": "Skills for Dash Platform developers — data contracts, Rust SDK, JS SDK, and API lexicon",
      "author": {
        "name": "lklimek"
      },
      "repository": "https://github.com/lklimek/claudash",
      "license": "GPL-3.0",
      "category": "blockchain",
      "tags": [
        "dash",
        "blockchain",
        "rust",
        "javascript",
        "grpc",
        "platform"
      ]
    },
    {
      "name": "claudius",
      "source": {
        "source": "github",
        "repo": "lklimek/claudius"
      },
      "version": "7.1.0",
      "description": "Collection of specialized development agents and skills for Claude Code",
      "author": {
        "name": "lklimek",
        "url": "https://github.com/lklimek"
      },
      "repository": "https://github.com/lklimek/claudius",
      "license": "GPL-3.0",
      "category": "productivity",
      "tags": [
        "dev-lifecycle",
        "agents",
        "workflow",
        "productivity"
      ],
      "mcpServers": "./.claude-plugin/.mcp.json"
    },
    {
      "name": "memcan",
      "source": {
        "source": "github",
        "repo": "lklimek/memcan"
      },
      "version": "2.0.1",
      "description": "Persistent memory for Claude Code — save and recall learnings, decisions, preferences across sessions.",
      "author": {
        "name": "lklimek",
        "url": "https://github.com/lklimek"
      },
      "repository": "https://github.com/lklimek/memcan",
      "license": "MIT",
      "keywords": [
        "memory",
        "lancedb",
        "ollama",
        "persistent",
        "mcp"
      ],
      "category": "productivity",
      "tags": [
        "memory",
        "lancedb",
        "ollama",
        "persistent",
        "mcp"
      ],
      "mcpServers": "./.claude-plugin/.mcp.json"
    }
  ]
}
